{
  "_copyright": "© 2026 Fernando Rodrigues de Jácomo",
  "_project": "Projeto Comunitário de Milreu",
  "_rights": "Consultar RIGHTS.md; os direitos do conteúdo permanecem sujeitos às fontes e aos respetivos titulares.",
  "schemaVersion": "0.1.0",
  "recordType": "museum-memory",
  "initiativeId": "museum-of-memories",
  "id": "MM202608",
  "recordStatus": "preliminary",
  "publicationStatus": "review-required",
  "dataState": "preliminary",
  "localisationStatus": {
    "pt-PT": "source",
    "en": "draft",
    "es": "missing",
    "fr": "missing"
  },
  "title": {
    "pt-PT": "Edifício de cultos, potencialmente em 1910",
    "en": "Cult building, potentially in 1910",
    "es": null,
    "fr": null
  },
  "narratives": {
    "shortDescription": {
      "pt-PT": "Registo fotográfico em frente ao edifício de cultos de Milreu, potencialmente datado de 1910 segundo relatos orais.",
      "en": null,
      "es": null,
      "fr": null
    },
    "objectiveDescription": {
      "pt-PT": "Fotografia em frente ao edifício de cultos de Milreu, potencialmente datada de 1910 segundo relatos orais. A descrição foi divulgada na página ALDEIA DE ESTOI — CULTURA E PATRIMÓNIO, gerida por Luís Barriga.",
      "en": null,
      "es": null,
      "fr": null
    },
    "communityNarrative": {
      "pt-PT": "A datação depende de relatos orais e deve permanecer assinalada como hipótese.",
      "en": null,
      "es": null,
      "fr": null
    },
    "historicalContext": {
      "pt-PT": "O edifício de cultos é um dos elementos mais marcantes do conjunto arqueológico de Milreu e aparece em várias fotografias históricas e comunitárias.",
      "en": null,
      "es": null,
      "fr": null
    },
    "institutionalContext": {
      "pt-PT": null,
      "en": null,
      "es": null,
      "fr": null
    }
  },
  "date": {
    "display": {
      "pt-PT": "potencialmente 1910",
      "en": null,
      "es": null,
      "fr": null
    },
    "normalizedStart": "1910",
    "normalizedEnd": "1910",
    "precision": "year",
    "certainty": "hypothesis",
    "sourceRefs": [
      "SRC-MM202608-LEGACY"
    ]
  },
  "places": [
    {
      "id": null,
      "publicLabel": {
        "pt-PT": "Ruínas Romanas de Milreu, Estoi, Faro",
        "en": null,
        "es": null,
        "fr": null
      },
      "specificLabel": {
        "pt-PT": "Em frente ao edifício de cultos de Milreu",
        "en": null,
        "es": null,
        "fr": null
      },
      "precision": "area",
      "coordinates": null,
      "sensitivity": "public",
      "publicationAllowed": false,
      "certainty": "not-assessed",
      "sourceRefs": [
        "SRC-MM202608-LEGACY"
      ]
    }
  ],
  "people": [],
  "classification": {
    "primaryType": "memória comunitária",
    "secondaryTypes": [],
    "periodLabel": {
      "pt-PT": "Século XX",
      "en": null,
      "es": null,
      "fr": null
    },
    "tags": [
      "Milreu",
      "edifício de cultos",
      "Estoi",
      "1910",
      "história oral"
    ]
  },
  "media": [
    {
      "id": "ASSET-MM202608-LEGACY",
      "role": "public-derivative",
      "fileName": "MM202608.jpg",
      "storage": "legacy-site",
      "mimeType": "image/jpeg",
      "checksum": "sha256:99c4be2b9786cb2d79e5a28805bfa4d46ba22cd4d0044be6c7ca3728810c2995",
      "credit": {
        "pt-PT": "Página ALDEIA DE ESTOI — CULTURA E PATRIMÓNIO, gerida por Luís Barriga.",
        "en": null,
        "es": null,
        "fr": null
      },
      "publicationAllowed": false,
      "rightsStatus": "pending-review",
      "digitalInterventions": []
    }
  ],
  "rightsAndConsent": {
    "rightsStatus": "pending-review",
    "consentStatus": "pending-review",
    "publicationBasis": "pending-review",
    "concernStatus": "none-reported",
    "withdrawalAvailable": true,
    "publicNoticeRequired": true,
    "evidenceRefs": [
      "SRC-MM202608-LEGACY",
      "SRC-MM202608-ORIGIN"
    ],
    "notes": {
      "pt-PT": "Uso dependente de validação de autoria, autorização e direitos de imagem.",
      "en": null,
      "es": null,
      "fr": null
    }
  },
  "sources": [
    {
      "id": "SRC-MM202608-LEGACY",
      "type": "project-documentation",
      "citation": "Registo legado do Museu de Memórias de Milreu: MM202608.",
      "locator": "data/museum-items.js#MM202608",
      "access": "restricted",
      "supports": [
        "title",
        "narratives",
        "date",
        "places",
        "people",
        "classification",
        "relations"
      ],
      "certainty": "not-assessed",
      "rightsReviewStatus": "pending-review"
    },
    {
      "id": "SRC-MM202608-ORIGIN",
      "type": "social-media",
      "citation": "Página ALDEIA DE ESTOI — CULTURA E PATRIMÓNIO, gerida por Luís Barriga.",
      "locator": null,
      "access": "public-metadata",
      "supports": [
        "credit",
        "media",
        "rights"
      ],
      "certainty": "not-assessed",
      "rightsReviewStatus": "pending-review"
    }
  ],
  "provenance": [
    {
      "id": "PROV-MM202608-MIGRATION-01",
      "eventType": "catalogued",
      "date": "2026-07-20",
      "agentReference": "PACKAGE-04-MIGRATION",
      "description": {
        "pt-PT": "Conversão mecânica e conservadora do registo legado para o schema 0.1.0. O conteúdo permanece preliminar e exige revisão humana.",
        "en": null,
        "es": null,
        "fr": null
      },
      "sourceRefs": [
        "SRC-MM202608-LEGACY"
      ],
      "certainty": "certain"
    }
  ],
  "communityVoices": [],
  "relations": [
    {
      "relationType": "related-to",
      "targetType": "memory",
      "targetId": "MM202602",
      "direction": "bidirectional",
      "certainty": "not-assessed",
      "notes": {
        "pt-PT": "Relação preservada a partir do campo relatedIds do registo legado; a reciprocidade e o tipo de relação exigem revisão.",
        "en": null,
        "es": null,
        "fr": null
      }
    },
    {
      "relationType": "related-to",
      "targetType": "memory",
      "targetId": "MM202605",
      "direction": "bidirectional",
      "certainty": "not-assessed",
      "notes": {
        "pt-PT": "Relação preservada a partir do campo relatedIds do registo legado; a reciprocidade e o tipo de relação exigem revisão.",
        "en": null,
        "es": null,
        "fr": null
      }
    },
    {
      "relationType": "related-to",
      "targetType": "memory",
      "targetId": "MM202609",
      "direction": "bidirectional",
      "certainty": "not-assessed",
      "notes": {
        "pt-PT": "Relação preservada a partir do campo relatedIds do registo legado; a reciprocidade e o tipo de relação exigem revisão.",
        "en": null,
        "es": null,
        "fr": null
      }
    }
  ],
  "audit": {
    "recordVersion": "0.1.0-migrated-preliminary",
    "createdAt": "2026-07-20T00:00:00Z",
    "createdByReference": "PACKAGE-04-MIGRATION",
    "updatedAt": null,
    "updatedByReference": null,
    "sourceSystem": "museum-v1:data/museum-items.js",
    "previousVersionReference": "legacy:MM202608",
    "changeReason": "Migração preliminar, reversível e sem alteração do estado de publicação."
  },
  "extensions": {
    "migrationBatch": "PACKAGE-04-v0.1.0",
    "sourceFingerprint": "sha256:12fe24c5bc7d29327ca61cf9b1686822d16f0ec118ae457f9cdaa035d4aa98f1",
    "legacyFieldsPreserved": true,
    "legacyBlankFields": [
      "peoplePublic",
      "communityVoices"
    ],
    "narrativeLayerReviewRequired": true,
    "rightsReviewRequired": true,
    "personIdentificationReviewRequired": false,
    "placeReviewRequired": true,
    "dateReviewRequired": true,
    "translationReviewRequired": true,
    "sourceCitationReviewRequired": true,
    "containsQuotedCommunityMaterial": false,
    "explicitDigitalInterventionMentioned": false,
    "imageFoundInLegacySite": true,
    "legacy": {
      "id": "MM202608",
      "filename": "MM202608.jpg",
      "title": "Edifício de cultos, potencialmente em 1910",
      "titleEn": "Cult building, potentially in 1910",
      "descriptionShort": "Registo fotográfico em frente ao edifício de cultos de Milreu, potencialmente datado de 1910 segundo relatos orais.",
      "descriptionLong": "Fotografia em frente ao edifício de cultos de Milreu, potencialmente datada de 1910 segundo relatos orais. A descrição foi divulgada na página ALDEIA DE ESTOI — CULTURA E PATRIMÓNIO, gerida por Luís Barriga.",
      "year": "1910",
      "dateApprox": "potencialmente 1910",
      "period": "Século XX",
      "locationSpecific": "Em frente ao edifício de cultos de Milreu",
      "locationPublic": "Ruínas Romanas de Milreu, Estoi, Faro",
      "peoplePublic": "",
      "memoryType": "memória comunitária",
      "memoryText": "A datação depende de relatos orais e deve permanecer assinalada como hipótese.",
      "historicalContext": "O edifício de cultos é um dos elementos mais marcantes do conjunto arqueológico de Milreu e aparece em várias fotografias históricas e comunitárias.",
      "credit": "Página ALDEIA DE ESTOI — CULTURA E PATRIMÓNIO, gerida por Luís Barriga.",
      "rights": "Uso dependente de validação de autoria, autorização e direitos de imagem.",
      "tags": [
        "Milreu",
        "edifício de cultos",
        "Estoi",
        "1910",
        "história oral"
      ],
      "relatedIds": [
        "MM202602",
        "MM202605",
        "MM202609"
      ],
      "communityVoices": []
    }
  }
}
